{
  "$schema": "../../../schemas/records/offer.schema.json",
  "schema_version": "2.0.0",
  "id": "offer.comdex82_upgrade_autocad",
  "record_type": "offer",
  "data": {
    "id": "offer.comdex82_upgrade_autocad",
    "name": "Professional graphics upgrade and AutoCAD",
    "category": "upgrade_bundle",
    "vendor": "Logix",
    "introduced": {
      "event_name": "COMDEX 1982 cost review",
      "event_start_date": "1982-11-29"
    },
    "status": "Dated reviewed offering; review date is not a confirmed shipment date.",
    "description": "Dated commercial review; technical specification not separately recorded.",
    "notes": [
      "Canonical identity extracted from manufacturing cost review; cost figures remain owned by the dated review."
    ]
  }
}
