{
  "$schema": "../../../schemas/records/offer.schema.json",
  "schema_version": "2.0.0",
  "id": "bundle.artemis_pro_512_server",
  "record_type": "offer",
  "data": {
    "id": "bundle.artemis_pro_512_server",
    "name": "Artemis PRO 512 KB server",
    "introduced": {
      "event_name": "NCC 1981 — Logix networking / Artemis PRO launch",
      "event_start_date": "1981-05-04"
    },
    "computer_ref": "computer.artemis_pro",
    "computer_configuration": {
      "ram_kb": 512,
      "hdd_mb": 5,
      "ram_configuration_id": "m128_512",
      "module_ref": "part.ram_128kb_x32",
      "populated_modules": 4,
      "populated_banks": 2
    },
    "included_software": [
      "software.aionix_server"
    ],
    "availability": "Announced at NCC 1981; shipment date not separately specified.",
    "availability_status": "announced",
    "shipping_date": null,
    "bom_assembly_ref": "assembly.bundle.artemis_pro_512_server",
    "vendor": "Logix",
    "category": "system_bundle"
  }
}
