{
  "$schema": "../../../schemas/records/offer.schema.json",
  "schema_version": "2.0.0",
  "id": "bundle.artemis_256_color",
  "record_type": "offer",
  "data": {
    "id": "bundle.artemis_256_color",
    "name": "Logix Artemis 256 KB — Color system",
    "introduced": {
      "event_name": "NCC 1980 — Logix Artemis launch",
      "event_start_date": "1980-05-19"
    },
    "computer_ref": "computer.artemis",
    "computer_configuration": {
      "ram_kb": 256,
      "ram_configuration_id": "m128_256",
      "module_ref": "part.artemis_ram_module_128kb_aion",
      "populated_modules": 2,
      "populated_banks": 1,
      "video_card_ref": "device.artemis_video_card"
    },
    "included_devices": [
      "device.flexibus_keyboard",
      "device.color_monitor_2"
    ],
    "included_software": [
      "software.aionix"
    ],
    "included_services": [
      {
        "service_ref": "service.regular_support",
        "duration_years": 1
      }
    ],
    "bom_assembly_ref": "assembly.bundle.artemis_256_color",
    "manufacturing_variants": [
      {
        "effective_from": "1981-05-04",
        "assembly_ref": "assembly.bundle.artemis_256_color.networked"
      }
    ],
    "vendor": "Logix",
    "category": "system_bundle"
  }
}
